{
  "$schema": "https://json-schema.org/draft/2020-12/schema",
  "$id": "https://signal-engine.local/schemas/long_context_case_prompt_pack.schema.json",
  "title": "Signal Engine long-context case prompt pack",
  "type": "object",
  "required": [
    "prompt_pack_id",
    "generated_at",
    "status_label",
    "case_id",
    "source_case_bundle_path",
    "source_bundle_id",
    "allowed_input_refs",
    "blocked_input_types",
    "reviewer_instruction_sections",
    "expected_output_schema_ref",
    "citation_requirements",
    "faithfulness_checks",
    "overclaim_guardrails",
    "readiness_flags",
    "blocked_reasons",
    "provider_execution",
    "llm_called",
    "model_output_present",
    "evaluated_model_quality",
    "production_claims"
  ],
  "properties": {
    "prompt_pack_id": {"type": "string", "pattern": "^long_context_prompt_pack:[a-z0-9_]+$"},
    "generated_at": {"type": "string", "pattern": "^\\d{4}-\\d{2}-\\d{2}T\\d{2}:\\d{2}:\\d{2}Z$"},
    "status_label": {"const": "long_context_case_prompt_pack_scaffold_only"},
    "case_id": {"type": "string", "minLength": 1},
    "source_case_bundle_path": {"type": "string", "minLength": 1},
    "source_bundle_id": {"type": "string", "minLength": 1},
    "allowed_input_refs": {
      "type": "object",
      "required": [
        "case_bundle",
        "retrieval_object_refs",
        "reviewed_query_refs",
        "provenance_refs",
        "safe_report_refs"
      ],
      "properties": {
        "case_bundle": {
          "type": "object",
          "required": ["bundle_id", "case_id", "path", "status_label"],
          "properties": {
            "bundle_id": {"type": "string", "minLength": 1},
            "case_id": {"type": "string", "minLength": 1},
            "path": {"type": "string", "minLength": 1},
            "status_label": {"const": "case_review_bundle_metadata_only"}
          },
          "additionalProperties": false
        },
        "retrieval_object_refs": {
          "type": "array",
          "minItems": 1,
          "items": {
            "type": "object",
            "required": [
              "object_id",
              "object_type",
              "case_id",
              "source_hash",
              "text_hash",
              "provenance_hash",
              "provenance_ref",
              "section_label",
              "speaker_role",
              "topic"
            ],
            "properties": {
              "object_id": {"type": "string", "pattern": "^rom_(semantic|event|evidence)_[0-9a-f]{16}$"},
              "object_type": {"type": "string", "minLength": 1},
              "case_id": {"type": "string", "minLength": 1},
              "source_hash": {"type": "string", "pattern": "^sha256:[0-9a-f]{64}$"},
              "text_hash": {"type": "string", "pattern": "^sha256:[0-9a-f]{64}$"},
              "provenance_hash": {"type": "string", "pattern": "^sha256:[0-9a-f]{64}$"},
              "provenance_ref": {"type": "string", "minLength": 1},
              "section_label": {"type": "string"},
              "speaker_role": {"type": "string"},
              "topic": {"type": "string"}
            },
            "additionalProperties": false
          }
        },
        "reviewed_query_refs": {
          "type": "array",
          "items": {
            "type": "object",
            "required": [
              "query_id",
              "query_type",
              "case_id",
              "expected_object_ids",
              "evidence_object_id_refs",
              "provenance_refs",
              "review_status",
              "benchmark_eligible"
            ],
            "properties": {
              "query_id": {"type": "string", "minLength": 1},
              "query_type": {"type": "string", "minLength": 1},
              "case_id": {"type": "string", "minLength": 1},
              "expected_object_ids": {"type": "array", "items": {"type": "string"}},
              "evidence_object_id_refs": {"type": "array", "items": {"type": "string"}},
              "provenance_refs": {"type": "array", "items": {"type": "string"}},
              "review_status": {"type": "string", "minLength": 1},
              "benchmark_eligible": {"type": "boolean"}
            },
            "additionalProperties": false
          }
        },
        "provenance_refs": {"type": "array", "minItems": 1, "items": {"type": "string", "minLength": 1}},
        "safe_report_refs": {"type": "array", "items": {"type": "object"}}
      },
      "additionalProperties": false
    },
    "blocked_input_types": {"type": "array", "items": {"type": "string", "minLength": 1}},
    "reviewer_instruction_sections": {"type": "array", "minItems": 1, "items": {"type": "object"}},
    "expected_output_schema_ref": {"const": "schemas/long_context_case_review_output.schema.json"},
    "citation_requirements": {"type": "array", "minItems": 1, "items": {"type": "string", "minLength": 1}},
    "faithfulness_checks": {"type": "array", "minItems": 1, "items": {"type": "string", "minLength": 1}},
    "overclaim_guardrails": {"type": "array", "minItems": 1, "items": {"type": "string", "minLength": 1}},
    "readiness_flags": {
      "type": "object",
      "required": [
        "has_case_bundle",
        "has_allowed_input_refs",
        "has_provenance_refs",
        "has_reviewed_query_refs",
        "prompt_template_only",
        "provider_ready",
        "llm_review_ready",
        "benchmark_ready"
      ],
      "properties": {
        "has_case_bundle": {"type": "boolean"},
        "has_allowed_input_refs": {"type": "boolean"},
        "has_provenance_refs": {"type": "boolean"},
        "has_reviewed_query_refs": {"type": "boolean"},
        "prompt_template_only": {"const": true},
        "provider_ready": {"const": false},
        "llm_review_ready": {"const": false},
        "benchmark_ready": {"const": false}
      },
      "additionalProperties": false
    },
    "blocked_reasons": {"type": "array", "items": {"type": "string", "minLength": 1}},
    "provider_execution": {"const": false},
    "llm_called": {"const": false},
    "model_output_present": {"const": false},
    "evaluated_model_quality": {"const": false},
    "production_claims": {"const": false}
  },
  "additionalProperties": false
}
