{"allowed_input_refs":{"case_bundle":{"bundle_id":"case_review_bundle:rddt_2025_q3","case_id":"rddt_2025_q3","path":"reports/case_bundles/rddt_2025_q3.case_review_bundle.json","status_label":"case_review_bundle_metadata_only"},"provenance_refs":["/Users/keith/Desktop/earnings calls 100 samples/RDDT_Reddit_Inc/rddt_2025_q3/metadata/normalized_transcript.json"],"retrieval_object_refs":[{"case_id":"rddt_2025_q3","object_id":"rom_evidence_b6675bcda5ed4126","object_type":"evidence_object_metadata","provenance_hash":"sha256:6b8e52088d5da2254e56515bcdc96622c4889ea95779a963785c775b372d3acd","provenance_ref":"/Users/keith/Desktop/earnings calls 100 samples/RDDT_Reddit_Inc/rddt_2025_q3/metadata/normalized_transcript.json","section_label":"prepared_remarks","source_hash":"sha256:692e3e2fbff056431c1638e2b08baa506bd270ef55063c4f5b2c20a5059c4353","speaker_role":"management","text_hash":"sha256:e91b70b819a3734d2850132786a4585e2d4042efc3d1012ec68f9e09945cb413","topic":"prepared_remarks"},{"case_id":"rddt_2025_q3","object_id":"rom_event_632d25c9583140cd","object_type":"event_aligned_chunk_metadata","provenance_hash":"sha256:043eddbb2fcbcfa81d022b6e04479e36b3728b1cd1c44c43b97e6bf67b193c82","provenance_ref":"/Users/keith/Desktop/earnings calls 100 samples/RDDT_Reddit_Inc/rddt_2025_q3/metadata/normalized_transcript.json","section_label":"prepared_remarks","source_hash":"sha256:692e3e2fbff056431c1638e2b08baa506bd270ef55063c4f5b2c20a5059c4353","speaker_role":"management","text_hash":"sha256:e91b70b819a3734d2850132786a4585e2d4042efc3d1012ec68f9e09945cb413","topic":"prepared_remarks"}],"reviewed_query_refs":[],"safe_report_refs":[{"exists":true,"path":"reports/retrieval/retrieval_object_metadata_export.md","report_type":"retrieval_object_metadata_export"},{"exists":true,"path":"reports/retrieval/retrieval_reviewed_query_set_first20_packet.md","report_type":"first20_review_packet"},{"exists":true,"path":"reports/retrieval/retrieval_bakeoff_first20_review_pending_plan.md","report_type":"first20_bakeoff_plan"},{"exists":true,"path":"reports/retrieval/retrieval_review_import_summary.md","report_type":"review_import_summary"}]},"blocked_input_types":["raw_transcript_text","raw_chunk_text","raw_evidence_text","provider_outputs","model_outputs","embeddings","vector_store_artifacts","labels_or_adjudication_rows"],"blocked_reasons":["benchmark_threshold_not_met","evaluated_model_quality_false","evaluated_retrieval_quality_false","llm_execution_disabled","llm_review_disabled","model_output_absent","no_benchmark_eligible_query_rows","no_reviewed_query_rows_for_case","prompt_pack_scaffold_only","provider_execution_disabled"],"case_id":"rddt_2025_q3","citation_requirements":["cite_object_id_for_each_conclusion","cite_provenance_ref_for_each_conclusion","abstain_when_refs_are_missing_or_insufficient"],"evaluated_model_quality":false,"expected_output_schema_ref":"schemas/long_context_case_review_output.schema.json","faithfulness_checks":["all_claims_have_object_refs","all_claims_have_provenance_refs","no_conclusion_from_missing_metadata","deterministic_extraction_remains_canonical"],"generated_at":"1970-01-01T00:00:00Z","llm_called":false,"model_output_present":false,"overclaim_guardrails":["no_market_action_recommendations","no_return_edge_claims","no_unsupported_quantitative_validity_claims","no_production_quality_claims"],"production_claims":false,"prompt_pack_id":"long_context_prompt_pack:rddt_2025_q3","provider_execution":false,"readiness_flags":{"benchmark_ready":false,"has_allowed_input_refs":true,"has_case_bundle":true,"has_provenance_refs":true,"has_reviewed_query_refs":false,"llm_review_ready":false,"prompt_template_only":true,"provider_ready":false},"reviewer_instruction_sections":[{"instructions":["Use only the provided metadata references.","Treat deterministic extraction and provenance references as canonical routing inputs."],"section_id":"scope","title":"Scope"},{"instructions":["Every conclusion must cite at least one object_id.","Every conclusion must cite at least one provenance_ref."],"section_id":"citations","title":"Citation Requirements"},{"instructions":["Return cannot_answer_reasons when the provided refs do not support a conclusion.","Do not infer from missing or unsafe evidence."],"section_id":"abstention","title":"Abstention"},{"instructions":["Do not make market action recommendations.","Do not make return-edge or unsupported quantitative-validity claims.","Do not describe this packet as deployment-grade evidence."],"section_id":"claim_boundaries","title":"Claim Boundaries"}],"source_bundle_id":"case_review_bundle:rddt_2025_q3","source_case_bundle_path":"reports/case_bundles/rddt_2025_q3.case_review_bundle.json","status_label":"long_context_case_prompt_pack_scaffold_only"}
