{"allowed_input_refs":{"case_bundle":{"bundle_id":"case_review_bundle:jpm_2025_q4","case_id":"jpm_2025_q4","path":"reports/case_bundles/jpm_2025_q4.case_review_bundle.json","status_label":"case_review_bundle_metadata_only"},"provenance_refs":["/Users/keith/Desktop/earnings calls 100 samples/JPM_JPMorgan_Chase_Co/jpm_2025_q4/metadata/normalized_transcript.json"],"retrieval_object_refs":[{"case_id":"jpm_2025_q4","object_id":"rom_evidence_34ac02b34c0ba0dd","object_type":"evidence_object_metadata","provenance_hash":"sha256:b925ce54aa3fdb68537306fe720092f9dd57954ce0748b58d63c8850b09791cc","provenance_ref":"/Users/keith/Desktop/earnings calls 100 samples/JPM_JPMorgan_Chase_Co/jpm_2025_q4/metadata/normalized_transcript.json","section_label":"prepared_remarks","source_hash":"sha256:624b4bf0fe79bdd4e1cb7361b1bb3992d06272ce9c40f6fe29394e6a4963ffae","speaker_role":"management","text_hash":"sha256:8e2a343c5862cc1cbc540e12580c813c7d00e651c774d7f6986c3a40dc9b8b6e","topic":"prepared_remarks"},{"case_id":"jpm_2025_q4","object_id":"rom_event_25062312bff5b04c","object_type":"event_aligned_chunk_metadata","provenance_hash":"sha256:13b3f41b1e7cdf1ccdcd5ecbf51a5e88c63ea9c27d3556e4daa97da78ee889e3","provenance_ref":"/Users/keith/Desktop/earnings calls 100 samples/JPM_JPMorgan_Chase_Co/jpm_2025_q4/metadata/normalized_transcript.json","section_label":"prepared_remarks","source_hash":"sha256:624b4bf0fe79bdd4e1cb7361b1bb3992d06272ce9c40f6fe29394e6a4963ffae","speaker_role":"management","text_hash":"sha256:8e2a343c5862cc1cbc540e12580c813c7d00e651c774d7f6986c3a40dc9b8b6e","topic":"prepared_remarks"},{"case_id":"jpm_2025_q4","object_id":"rom_semantic_20183bd840f2073f","object_type":"semantic_chunk_metadata","provenance_hash":"sha256:0bfa0b2afd7ca9b05e371c8a934ff6f77166038a48b8f9ebd19f5540cf157399","provenance_ref":"/Users/keith/Desktop/earnings calls 100 samples/JPM_JPMorgan_Chase_Co/jpm_2025_q4/metadata/normalized_transcript.json","section_label":"unknown","source_hash":"sha256:624b4bf0fe79bdd4e1cb7361b1bb3992d06272ce9c40f6fe29394e6a4963ffae","speaker_role":"unknown","text_hash":"sha256:d5da67c3ad168449f3bc4fe74a17229df328d45545760b8a7b0eb2e12265a0a8","topic":"semantic_fallback"},{"case_id":"jpm_2025_q4","object_id":"rom_semantic_6fdb443fc42df295","object_type":"semantic_chunk_metadata","provenance_hash":"sha256:9093669c56afbd13ba74735eeaf002681b777aafbf56b01486fa786f9cc5a070","provenance_ref":"/Users/keith/Desktop/earnings calls 100 samples/JPM_JPMorgan_Chase_Co/jpm_2025_q4/metadata/normalized_transcript.json","section_label":"unknown","source_hash":"sha256:624b4bf0fe79bdd4e1cb7361b1bb3992d06272ce9c40f6fe29394e6a4963ffae","speaker_role":"unknown","text_hash":"sha256:c50f03103146663dba0f625523929c70965e12fa6295544dfa0f1d2ea3ce35fc","topic":"semantic_fallback"},{"case_id":"jpm_2025_q4","object_id":"rom_semantic_e69621e960daa48a","object_type":"semantic_chunk_metadata","provenance_hash":"sha256:8e918d94e0520ec4e9d26f7b692387d3be3af8369c25a5888bb46511d5eb12f6","provenance_ref":"/Users/keith/Desktop/earnings calls 100 samples/JPM_JPMorgan_Chase_Co/jpm_2025_q4/metadata/normalized_transcript.json","section_label":"unknown","source_hash":"sha256:624b4bf0fe79bdd4e1cb7361b1bb3992d06272ce9c40f6fe29394e6a4963ffae","speaker_role":"unknown","text_hash":"sha256:2433187def858c7ef92c8b45edb17bfdb41fab4d79c17de38b9d47a31e5cfcb4","topic":"semantic_fallback"}],"reviewed_query_refs":[],"safe_report_refs":[{"exists":true,"path":"reports/retrieval/retrieval_object_metadata_export.md","report_type":"retrieval_object_metadata_export"},{"exists":true,"path":"reports/retrieval/retrieval_reviewed_query_set_first20_packet.md","report_type":"first20_review_packet"},{"exists":true,"path":"reports/retrieval/retrieval_bakeoff_first20_review_pending_plan.md","report_type":"first20_bakeoff_plan"},{"exists":true,"path":"reports/retrieval/retrieval_review_import_summary.md","report_type":"review_import_summary"}]},"blocked_input_types":["raw_transcript_text","raw_chunk_text","raw_evidence_text","provider_outputs","model_outputs","embeddings","vector_store_artifacts","labels_or_adjudication_rows"],"blocked_reasons":["benchmark_threshold_not_met","evaluated_model_quality_false","evaluated_retrieval_quality_false","llm_execution_disabled","llm_review_disabled","model_output_absent","no_benchmark_eligible_query_rows","no_reviewed_query_rows_for_case","prompt_pack_scaffold_only","provider_execution_disabled"],"case_id":"jpm_2025_q4","citation_requirements":["cite_object_id_for_each_conclusion","cite_provenance_ref_for_each_conclusion","abstain_when_refs_are_missing_or_insufficient"],"evaluated_model_quality":false,"expected_output_schema_ref":"schemas/long_context_case_review_output.schema.json","faithfulness_checks":["all_claims_have_object_refs","all_claims_have_provenance_refs","no_conclusion_from_missing_metadata","deterministic_extraction_remains_canonical"],"generated_at":"1970-01-01T00:00:00Z","llm_called":false,"model_output_present":false,"overclaim_guardrails":["no_market_action_recommendations","no_return_edge_claims","no_unsupported_quantitative_validity_claims","no_production_quality_claims"],"production_claims":false,"prompt_pack_id":"long_context_prompt_pack:jpm_2025_q4","provider_execution":false,"readiness_flags":{"benchmark_ready":false,"has_allowed_input_refs":true,"has_case_bundle":true,"has_provenance_refs":true,"has_reviewed_query_refs":false,"llm_review_ready":false,"prompt_template_only":true,"provider_ready":false},"reviewer_instruction_sections":[{"instructions":["Use only the provided metadata references.","Treat deterministic extraction and provenance references as canonical routing inputs."],"section_id":"scope","title":"Scope"},{"instructions":["Every conclusion must cite at least one object_id.","Every conclusion must cite at least one provenance_ref."],"section_id":"citations","title":"Citation Requirements"},{"instructions":["Return cannot_answer_reasons when the provided refs do not support a conclusion.","Do not infer from missing or unsafe evidence."],"section_id":"abstention","title":"Abstention"},{"instructions":["Do not make market action recommendations.","Do not make return-edge or unsupported quantitative-validity claims.","Do not describe this packet as deployment-grade evidence."],"section_id":"claim_boundaries","title":"Claim Boundaries"}],"source_bundle_id":"case_review_bundle:jpm_2025_q4","source_case_bundle_path":"reports/case_bundles/jpm_2025_q4.case_review_bundle.json","status_label":"long_context_case_prompt_pack_scaffold_only"}
